{
  "Schema": "4.0",
  "OsKey": "Server2099",
  "Common": {
    "Build": 99999,
    "OsShortName": "WS2099",
    "Edition": "Datacenter",
    "Architecture": "x64",
    "WimEdition": "Windows Server 2099 Datacenter (Desktop Experience)",
    "InstallWimIndex": 4,
    "BootWimIndexes": [
      1,
      2
    ],
    "WinReWimPath": "Windows\\System32\\Recovery\\Winre.wim",
    "SupportedLanguages": [
      "en-us",
      "ja-jp"
    ],
    "DefaultLanguage": "en-us",
    "LCUExpandViaMum": false,
    "EnableInstallWimUpdate": true,
    "BootWimLcuPolicy": "enabled",
    "EnableWinREUpdate": true,
    "UpdateAllInstallWimIndexes": true,
    "WinReDistributionPolicy": "ServiceOnceCopyToAllInstallIndexes",
    "BootWimFailurePolicy": "FailBuild",
    "_VerifiedDate": "2026-07-11T00:00:00+09:00",
    "_VerifiedBy": "research:data-model-v4"
  },
  "ServicingModel": {
    "MonthlyServicingStyle": "CombinedSSULCU",
    "SourcePrerequisitePolicy": "DetectAndInject",
    "DynamicUpdatePolicy": "SameMonthOrLatestPrior",
    "DotNetPolicy": "DetectInstalledRuntimePerIndex",
    "PackageRoleModel": "OneAssetMayServeMultipleRoles",
    "ApplyPlans": {
      "Install": [
        {
          "Order": 10,
          "Step": "SourcePrerequisite",
          "Roles": [
            "SourcePrerequisite",
            "CheckpointDependency"
          ],
          "Condition": "IfApplicable"
        },
        {
          "Order": 20,
          "Step": "ServicingStack",
          "Roles": [
            "ServicingStackCarrier"
          ],
          "Condition": "Required"
        },
        {
          "Order": 30,
          "Step": "LanguageFodOptionalComponents",
          "Roles": [
            "LanguagePack",
            "FOD",
            "OptionalComponent"
          ],
          "Condition": "IfConfigured"
        },
        {
          "Order": 40,
          "Step": "FinalLCU",
          "Roles": [
            "FinalLCU"
          ],
          "Condition": "Required"
        },
        {
          "Order": 50,
          "Step": "Cleanup",
          "Operation": "StartComponentCleanup",
          "Condition": "Required"
        },
        {
          "Order": 60,
          "Step": "DotNet",
          "Roles": [
            "DotNetLeaf"
          ],
          "Condition": "IfRuntimeDetected"
        },
        {
          "Order": 70,
          "Step": "Export",
          "Operation": "ExportImage",
          "Condition": "Required"
        }
      ],
      "Boot": [
        {
          "Order": 10,
          "Step": "SourcePrerequisite",
          "Roles": [
            "SourcePrerequisite",
            "CheckpointDependency"
          ],
          "Condition": "IfApplicable"
        },
        {
          "Order": 20,
          "Step": "ServicingStack",
          "Roles": [
            "ServicingStackCarrier"
          ],
          "Condition": "Required"
        },
        {
          "Order": 30,
          "Step": "WinPeLanguage",
          "Roles": [
            "WinPeLanguagePack"
          ],
          "Condition": "IfConfigured"
        },
        {
          "Order": 40,
          "Step": "FinalLCU",
          "Roles": [
            "FinalLCU"
          ],
          "Condition": "Required"
        },
        {
          "Order": 50,
          "Step": "Cleanup",
          "Operation": "StartComponentCleanup",
          "Condition": "Required"
        },
        {
          "Order": 60,
          "Step": "Export",
          "Operation": "ExportImage",
          "Condition": "Required"
        }
      ],
      "WinRE": [
        {
          "Order": 10,
          "Step": "SourcePrerequisite",
          "Roles": [
            "SourcePrerequisite",
            "CheckpointDependency"
          ],
          "Condition": "IfApplicableAndSupported"
        },
        {
          "Order": 20,
          "Step": "ServicingStack",
          "Roles": [
            "ServicingStackCarrier"
          ],
          "Condition": "Required"
        },
        {
          "Order": 30,
          "Step": "WinReLanguage",
          "Roles": [
            "WinReLanguagePack"
          ],
          "Condition": "IfConfigured"
        },
        {
          "Order": 40,
          "Step": "SafeOSDU",
          "Roles": [
            "SafeOSDU"
          ],
          "Condition": "IfResolved"
        },
        {
          "Order": 50,
          "Step": "Cleanup",
          "Operation": "StartComponentCleanup",
          "Condition": "Required"
        },
        {
          "Order": 60,
          "Step": "ExportRecovery",
          "Operation": "ExportImageRecoveryCompression",
          "Condition": "Required"
        },
        {
          "Order": 70,
          "Step": "Redistribute",
          "Operation": "CopyServicedWinReToAllInstallIndexes",
          "Condition": "Required"
        }
      ],
      "Media": [
        {
          "Order": 10,
          "Step": "SetupDU",
          "Roles": [
            "SetupDU"
          ],
          "Condition": "IfResolved"
        },
        {
          "Order": 20,
          "Step": "CopySetupExe",
          "Operation": "CopyFromBootWimIndex2",
          "Condition": "Required"
        },
        {
          "Order": 30,
          "Step": "CopySetupHost",
          "Operation": "CopyFromBootWimIndex2",
          "Condition": "IfBuild26100OrLater"
        },
        {
          "Order": 40,
          "Step": "CopyBootManager",
          "Operation": "CopyBootManagerAndBootStl",
          "Condition": "Required"
        },
        {
          "Order": 50,
          "Step": "BuildIso",
          "Operation": "Oscdimg",
          "Condition": "Required"
        }
      ]
    }
  },
  "DiscoveryPolicy": {
    "ReleaseChannel": "B",
    "ExcludePreview": true,
    "OobPolicy": "CreateEmergencyCandidate",
    "DynamicUpdateSelection": "SameMonthOrLatestPrior",
    "DotNetSelection": "LatestNonPreviewAtOrBeforeBaselineCutoff",
    "CatalogAliases": {
      "OsUpdate": "<catalog OS product alias>",
      "DynamicUpdate": "<catalog Dynamic Update alias>",
      "BuildFamily": "99999"
    },
    "SearchProfiles": {
      "LCU": {
        "QueryStrategy": "ExactKbFromReleaseHealth",
        "Architecture": "x64",
        "RejectTitleContains": [
          "Preview",
          "ARM64",
          "x86-based",
          ".NET Framework",
          "Hotpatch"
        ]
      },
      "SSU": {
        "QueryStrategy": "KbFromLcuPrerequisiteOrServicingStackArticle",
        "Architecture": "x64",
        "TitleMustContain": [
          "Servicing Stack Update"
        ]
      },
      "SafeOSDU": {
        "QueryStrategy": "SameMonthOrLatestPriorForBuildFamily",
        "Architecture": "x64",
        "ClassificationMustBe": [
          "Critical Updates"
        ],
        "ProductsMustContain": [
          "Windows Safe OS Dynamic Update"
        ]
      },
      "SetupDU": {
        "QueryStrategy": "SameMonthOrLatestPriorForBuildFamily",
        "Architecture": "x64",
        "ClassificationMustBe": [
          "Critical Updates"
        ],
        "ProductsMustContain": [
          "Windows 10 and later Dynamic Update"
        ],
        "ProductsMustNotContain": [
          "Windows Safe OS Dynamic Update"
        ]
      },
      "DotNet": {
        "QueryStrategy": "LeafKbFromDotNetReleaseNotesAndDetectedRuntime",
        "Architecture": "x64",
        "RejectTitleContains": [
          "Preview"
        ]
      }
    },
    "SourcePriority": [
      "https://learn.microsoft.com/en-us/windows/release-health/windows-server-release-info",
      "Microsoft Support KB",
      "Microsoft Update Catalog",
      "https://learn.microsoft.com/en-us/dotnet/framework/release-notes/release-notes",
      "SafeOS DU / Setup DU Support KB",
      "Monthly Windows Server images",
      "Windows release health / message center"
    ]
  },
  "PatchBaseline": {
    "Schema": "4.0",
    "BaselineId": "YYYY-MM-B",
    "Status": "Discovered",
    "ReleaseChannel": "B",
    "CutoffUtc": null,
    "TargetBuildAfterUpdate": "99999.0",
    "ChecksumAlgorithm": "SHA256",
    "SourcePrerequisites": [
      {
        "PrerequisiteId": "Server2099-source-prerequisite",
        "Kind": "BridgeLCU",
        "KbId": "KB0000000",
        "Roles": [
          "SourcePrerequisite"
        ],
        "Targets": [
          "Install",
          "Boot"
        ],
        "Condition": {
          "Mode": "IfSourceBelowFloor",
          "MinimumImageBuild": "99999.0",
          "Detection": [
            "Get-WindowsPackage",
            "Get-WindowsImage"
          ]
        },
        "Asset": null,
        "State": "Conditional",
        "Evidence": {
          "Levels": [
            "E1",
            "E2"
          ],
          "SourceUrls": [
            "https://support.microsoft.com/<LCU-KB>"
          ],
          "VerifiedAt": "2026-07-11T00:00:00+09:00",
          "VerifiedBy": "research:ChatGPT-2026-07-11",
          "Notes": [
            "Replace with the OS-specific prerequisite rule."
          ]
        }
      }
    ],
    "Lines": [
      {
        "PackageId": "Server2099-KB0000001-x64",
        "Kind": "LCU",
        "KbId": "KB0000001",
        "ParentKbId": null,
        "UpdateId": null,
        "Revision": null,
        "Title": null,
        "Products": null,
        "Classification": null,
        "Architecture": "x64",
        "ReleaseDate": null,
        "ReleaseType": "B",
        "State": "Discovered",
        "FileName": null,
        "DownloadUrl": null,
        "Digest": null,
        "Sha256": "",
        "SizeBytes": null,
        "ApplyOrder": 20,
        "InScope": {},
        "Note": "Populate UpdateId, revision, file identity and SHA-256 before Freeze.",
        "Roles": [
          "ServicingStackCarrier",
          "FinalLCU"
        ],
        "TargetsByRole": {
          "ServicingStackCarrier": [
            "Install",
            "Boot",
            "WinRE"
          ],
          "FinalLCU": [